{
  "id": "550e8400-e29b-41d4-a716-446655440000",
  "userId": "550e8400-e29b-41d4-a716-446655440000",
  "type": "user",
  "email": "john.doe@example.com",
  "displayName": "John Doe",
  "firstName": "John",
  "lastName": "Doe",
  "profilePictureUrl": "https://kbudgetstorage.blob.core.windows.net/profiles/550e8400.jpg",
  "currency": "USD",
  "locale": "en-US",
  "timezone": "America/New_York",
  "defaultBudgetPeriod": "monthly",
  "startOfWeek": 0,
  "fiscalYearStart": 1,
  "enableEmailNotifications": true,
  "enablePushNotifications": false,
  "enableBudgetAlerts": true,
  "budgetAlertThreshold": 80,
  "enableRollover": true,
  "createdAt": "2026-02-15T10:30:00Z",
  "createdBy": "550e8400-e29b-41d4-a716-446655440000",
  "updatedAt": "2026-02-15T14:25:00Z",
  "updatedBy": "550e8400-e29b-41d4-a716-446655440000",
  "isActive": true,
  "lastLoginAt": "2026-02-15T14:25:00Z",
  "version": "1.0"
}
