{
  "id": "880e8400-e29b-41d4-a716-446655440003",
  "userId": "880e8400-e29b-41d4-a716-446655440003",
  "type": "user",
  "email": "deleted.user@example.com",
  "displayName": "Deleted User",
  "currency": "USD",
  "locale": "en-US",
  "timezone": "America/New_York",
  "defaultBudgetPeriod": "monthly",
  "startOfWeek": 0,
  "fiscalYearStart": 1,
  "enableEmailNotifications": false,
  "enablePushNotifications": false,
  "enableBudgetAlerts": false,
  "budgetAlertThreshold": 80,
  "enableRollover": true,
  "createdAt": "2025-01-10T12:00:00Z",
  "createdBy": "880e8400-e29b-41d4-a716-446655440003",
  "updatedAt": "2026-02-01T16:45:00Z",
  "updatedBy": "880e8400-e29b-41d4-a716-446655440003",
  "isActive": false,
  "lastLoginAt": "2026-01-28T10:00:00Z",
  "version": "1.0"
}
