{
  "id": "660e8400-e29b-41d4-a716-446655440001",
  "userId": "660e8400-e29b-41d4-a716-446655440001",
  "type": "user",
  "email": "jane.smith@example.co.uk",
  "displayName": "Jane Smith",
  "firstName": "Jane",
  "lastName": "Smith",
  "currency": "GBP",
  "locale": "en-GB",
  "timezone": "Europe/London",
  "defaultBudgetPeriod": "monthly",
  "startOfWeek": 1,
  "fiscalYearStart": 4,
  "enableEmailNotifications": true,
  "enablePushNotifications": true,
  "enableBudgetAlerts": true,
  "budgetAlertThreshold": 90,
  "enableRollover": false,
  "createdAt": "2026-02-14T08:15:00Z",
  "createdBy": "660e8400-e29b-41d4-a716-446655440001",
  "updatedAt": "2026-02-15T09:30:00Z",
  "updatedBy": "660e8400-e29b-41d4-a716-446655440001",
  "isActive": true,
  "lastLoginAt": "2026-02-15T09:30:00Z",
  "version": "1.0"
}
