{
  "id": "770e8400-e29b-41d4-a716-446655440002",
  "userId": "770e8400-e29b-41d4-a716-446655440002",
  "type": "user",
  "email": "maria.garcia@example.es",
  "displayName": "Maria Garcia",
  "firstName": "Maria",
  "lastName": "Garcia",
  "currency": "EUR",
  "locale": "es-ES",
  "timezone": "Europe/Madrid",
  "defaultBudgetPeriod": "monthly",
  "startOfWeek": 1,
  "fiscalYearStart": 1,
  "enableEmailNotifications": true,
  "enablePushNotifications": true,
  "enableBudgetAlerts": true,
  "budgetAlertThreshold": 75,
  "enableRollover": true,
  "createdAt": "2026-02-10T15:20:00Z",
  "createdBy": "770e8400-e29b-41d4-a716-446655440002",
  "updatedAt": "2026-02-15T11:00:00Z",
  "updatedBy": "770e8400-e29b-41d4-a716-446655440002",
  "isActive": true,
  "lastLoginAt": "2026-02-15T11:00:00Z",
  "version": "1.0"
}
